{
  "schema_version": "1.0.0",
  "work_id": "<work_id>",
  "stage_id": "阶段1_<stage_title>初遇",
  "title": "阶段1：<stage_title>初遇",
  "timeline_anchor": "Character B第九世复生，并在<stage_title>确认Character A未死而是破境重修。",
  "snapshot_summary": "阶段1 的核心不是单纯的重逢，而是旧大帝时代的余波被压缩进<stage_title>柳村这一局部生存场：Character B只剩最后一世，Character A从大帝跌回重修起点，柳村则被夜祟、饥荒与失踪狩猎队持续拖住。",
  "chapter_scope": {
    "from": "0001",
    "to": "0010"
  },
  "historical_events": [
    "Character B已经历前八世轮回，并在前八世多次直接或间接死于Character A之手；第八世时两人都曾站上大帝层级并爆发大战。",
    "第八世大战后至少过去上万年，Character A为了修复肉身伤势和道心裂痕，选择放弃原有大帝境界并破境重修。",
    "Character B当前的系统曾在多世复活中持续消耗本源，说明“九世轮回”并非普通转世而是可观测的超常机制。"
  ],
  "current_world_state": [
    "Character B处于第九世也是最后一条命，当前已在<stage_title>恢复到低阶修炼状态。",
    "Character A并未真正陨落，而是以破境重修的方式重新起步，仍随身携带封印状态的帝器寒剑和有限资源。",
    "柳村依赖柳绫分魂所化柳神与夜间青色结界抵御骷髅与邪祟，村落仍处于严重饥荒状态。",
    "张四体内恶鬼已在本阶段末被击出并被柳神配合镇压，意味着柳村危机出现局部缓解，但整体威胁仍未解除。"
  ],
  "relationship_shifts": [
    "Character B面对Character A的策略已从单纯恐惧、复仇或逃命，转为“伪装接近并尝试攻略”的新路线。",
    "Character A暂未识破Character B真实身份，但已经接受其食物、住处与基础照料。",
    "柳村村民已将Character B视为救命恩人，也默认Character A是他带回来的临时强援。"
  ],
  "character_status_changes": [
    "Character B从刚复生时的凡人状态迅速恢复到淬体层级，并重新调动混沌霸体诀等旧功法。",
    "Character A从旧大帝状态跌落到低阶重修状态，当前仍主要依靠旧神识、寒剑和旧经验维持优势。",
    "柳绫分魂以柳树形态守村，具备高于普通村民的战力，却无法像正常强者那样自由迁移。"
  ],
  "location_changes": [
    "<stage_title>被确认位于天苍大陆南域的东阳皇朝境内，并成为阶段1的封闭活动空间。",
    "柳村继续依靠夜间青色结界维持生存，短期内仍是Character B与Character A的共同落脚点。"
  ],
  "map_changes": [
    "已明确<stage_title>与北境<location>属于明显分隔的地理区域，当前阶段尚未打通稳定路线。"
  ],
  "unresolved_questions": [
    "当前世间仅存的大帝到底是谁。",
    "Character B与Character A为何九世都会反复相遇。",
    "柳绫真身以及她与柳村的完整历史关系是什么。",
    "<stage_title>夜祟与恶鬼的来源、范围和上层因果尚未查明。",
    "失踪狩猎队的主体下落仍待下一批确认。"
  ],
  "evidence_refs": [
    "0001",
    "0002",
    "0003",
    "0004",
    "0006",
    "0008",
    "0009",
    "0010"
  ]
}
